<?xml version="1.0" encoding="UTF-8"?>
<list baseTax="20" xmlns:xsi="http://www.w3.org/2001/XMLSchema-instance" xsi:noNamespaceSchemaLocation="../xsd/buylist.xsd">
	<npcs>
		<npc>35186</npc> <!-- Arvid -->
	</npcs>
	<item id="6135" /> <!-- Dawn Mercenary Posting Ticket (Sword/Stationary) -->
	<item id="6136" /> <!-- Dawn Mercenary Posting Ticket (Spear/Stationary) -->
	<item id="6137" /> <!-- Dawn Mercenary Posting Ticket (Bow/Stationary) -->
	<item id="6138" /> <!-- Dawn Mercenary Posting Ticket (Cleric/Stationary) -->
	<item id="6139" /> <!-- Dawn Mercenary Posting Ticket (Wizard/Stationary) -->
	<item id="6140" /> <!-- Dawn Mercenary Posting Ticket (Sword/Mobile) -->
	<item id="6141" /> <!-- Dawn Mercenary Posting Ticket (Spear/Mobile) -->
	<item id="6142" /> <!-- Dawn Mercenary Posting Ticket (Bow/Mobile) -->
	<item id="6143" /> <!-- Dawn Mercenary Posting Ticket (Cleric/Mobile) -->
	<item id="6144" /> <!-- Dawn Mercenary Posting Ticket (Wizard/Mobile) -->
</list>
