<?xml version="1.0" encoding="UTF-8"?>
<list xmlns:xsi="http://www.w3.org/2001/XMLSchema-instance" xsi:noNamespaceSchemaLocation="../../xsd/buylist.xsd">
	<!-- (Paulinas) -->
	<item id="46881" price="0" />
	<item id="46882" price="0" />
	<item id="46883" price="0" />
	<item id="46884" price="0" />
	<item id="46885" price="0" />
	<item id="47038" price="0" />
	<item id="47039" price="0" />
	<item id="47040" price="0" />
	<item id="47041" price="0" />
	<item id="47042" price="0" />
	<item id="80052" price="0" />
	<item id="80053" price="0" />
	<item id="80054" price="0" />
	<item id="80055" price="0" />
	<item id="80056" price="0" />
	<item id="80057" price="0" />
	<item id="80320" price="0" />
</list>
